{
  "$ref": "#/definitions/books",
  "definitions": {
    "books": {
      "type": "object",
      "properties": {
        "title": {
          "type": "string"
        },
        "released": {
          "type": "number"
        },
        "author": {
          "type": "string"
        },
        "status": {
          "type": "string",
          "enum": [
            "to read",
            "currently reading",
            "finished"
          ]
        },
        "rating": {
          "type": "number"
        },
        "finished_on": {
          "type": "string"
        },
        "cover": {
          "type": "string"
        },
        "url": {
          "type": "string"
        },
        "isbn": {
          "type": "number"
        }
      },
      "required": [
        "title",
        "released",
        "author",
        "status",
        "cover"
      ],
      "additionalProperties": false
    }
  },
  "$schema": "http://json-schema.org/draft-07/schema#"
}